comment;label
wah gila cathes mengajarkan kita bahwa semua cewek yang pecicilan ud perawan;1
rata rata orang nolep pasti tertutup susah buat curhat ke sembarangan orang;1
chatez orang yang sangat jujur apa adanya sangat jarang ditemukan orang seperti;1
anjay kata plesetan ungkapan kesal dari kata anjing tarlalu keliatan kasar menurut;1
ngak mau kena resiko jangan main ome tv sayang open bo kah;1
anjay itu maksudnya anjing tapi diplesetin supaya kedengeran terlalu kasar nyebut anjing;1
chates kayak anak kecil pola fikirnya ded harus menyetarakan fikirnya juga;1
kek gini pasti ana kisah sad belakangnya nbanyak ketawa buat nutupi kesedihanya;1
spech composing bang dedy dengan bang hotman podcast kasus sambo kemarin htps;1
vivi shafitri bangke gua iseng lgi klik mana depan banyak orang tae;1
heters itu punya otak tolol otak kontol tolol heters paling bocah semua memek;1
dasar haters banyak bacot bisa apa arna iri gabisa jdi jelek kyk lu;1
rik gw request makanan yng berfaedah arna iri gabisa jdi jelek kyk lu;1
ngakak mulu gw kali liat video aja haters itu pd bocah ngentod smua;1
fucking beaches konten lu gilaa sih  fuck you beches bodoh indog mua kayak kontol pemalu indog;1
santai ric mereka ngejudge mah hidup disuguhin sama disuapin terus maklumin sadja kontol;1
anjing ngakak bangsat wkwk komen gw termasuk hate coment capslock bangsat ngakak anjing;1
woy konten lu gilaa sih o anjing lu kapan mati gua tungu tungu ngak mati mati anjing;1
bakal ancur ngentot yt rewind lo yang urus bangsat isinya rewind game kontol;1
tolong dong bang main pubg liatin kejantanan lu bang savage ric to lim;1
pantesan bnyk haters lo songong amet njing like setuju eriko lim hapus chanel;1
dasar haters haters tolol ngatain konten lu gilaa sih o tapi lo nonton konten dia bego anjink;1
mau chanel pendidikan sana nonton youtuber kepo anjing ytcrash kontol usah nonton ngentot;1
upload video musik dong bang please rainy days itu gua puter terus ngentod;1
gw tiap hari nonton lu tapi yang jelek jelek gw kagak tiru bang;1
dari pada lu baca komen haters mending lu liat banci tailand bacol rik;1
ngak usah hate coment anjing kaya iduplu yang paling bener aja dasar bangsad;1
jangan nangis bang jelekistrack haters ngak kayak ata geledekoutube rewand ngak ada bikintd;1
kekurangan konten kah ngan bacot aja ayo main squn kontol main fre fire;1
hm kecewa sama mu rick lu janji jt subs botak tapi ditepati anjing;1
kemaren gua makan bulu ketek gua plus jembut gua sendiri anjg ada rasanya;1
terkenal cuman gara gara ngomong anjing bangsat mr ro lah lu juga kaya;1
main pb rik kangen gw sama ke toxic an lu sat main pb;1
tim one gamers indonesia main pesawat lion air bocod bocah kontol anjeng ngentod;1
terus kenapa kalau blunder perlu juga anda buat menghina kesempatan kedua kaya gini;1
huseinabdulhamid dia pindah agama aja krna pansos sgala jelekn orng mentang bnyk duit;1
anak dikatain diperkosa smpe mati marah ngilran ngomongin keperawanan orang smpe ketawa geli;1
orang serba punya itu bebas coy dia konten menyindir gada masalah buat dia;1
dedi ngatain anaknya orng seneng bnget giliran anknya dikatain emosi terus gk terima;1
so true beberapa kali dia berkasus sama cewek posisinya lbh rendah dari dia;1
salam buat agung minimal laki enga ngondek laki enga tulang lunak ngelawan kodrat;1
nga semua orang bisa sksd sama orang lain emang dia cuek sifatnya bodoamat;1
agung syp si slma in gua main sosial media gk knl dia syp;1
lihat orang tolol yang kerjan cuma ngomentarin hidup orang merasa hidup paling benar;1
kaizofang dibayar berapa jadi buzer sampe organ tubuh cuma buat ungkapin ujaran kebencian;1
hey lu emang gk ad fyp gue mungkin konten lu nongolnya para bencong;1
mnrt gw sih nie bocah gila;1
alamat buat pelaku lebaran nanti baju orange;1
ferdian islam haha dia kan ateis;1
orang seperti lemparin aja batu ke muka mampus;1
anak lonte belum ketangkap hadeuh ketangkap tolong kasi bogem selangkangan kali;1
sampah sama batu lemparkan balik ke mukanya penuh itu lho apa suruh sini aj tak injak congornya;1
kalau mau membagi sembako ikhlas lah mau minta maf malah main main nanti masuk penjara semoga masuk penjara juga amin;1
anak dajal ada akhlak naudzubilahimindzalik kelakuan y keterlaluan bgd padahal bulan suci bukan y banyakin beramal malah numpukin dosa;1
berpendidikan sepertinya anak orang mampu tapi sayang ada otak miskin hati ngeprank banci moga penjara ketemu teman tu banci asoy balsem;1
coba ferdian ada pihak orang yang kasih sembako sampah darinya pasti dia merasa kehina;1
mungkin dia homoseks yang rejekinya merasa tersaingi waria;1
sakit kali bocah salah malah becandai punya otak begonya keliatan bgt;1
prasan konten pegng botol angur merah smbil nawar psk kayaknya ktulah orang stiap konten gth mulu mampus kau smoga pnjara;1
tindak saja bangst kali minta maf bo ongan salah buat hal pulak dasar manusia sesat;1
emperan receh sekalian satu ruangan sama semua waria tahu bagaimana hasil perbuatanya;1
oh muka yang ada abad kasihan ibunya lahirin anak iblis;1
wah malaikat bisa bong juga ternyata;1
minta maf tapi bong tapi jadi buron kabur ealah bocah bocah;1
najis norang kaya bgini tangkap trus injek injek;1
orang sakit jiwa dia lebih parah bencong;1
siap siap semua youtuber bakalan bantai so jadi njangan nangis penjara  gua itung itung lu akan mati penjara tuhan siap menungu hamba yang pernah prank;1
kelakuanmu otakmu itu kaya sampah yang bawa orang sinting otaknya dimana didikan darimana penghinan betul tolong dipolisikan;1
kl mau bantu mah tingal bantu aja gk usah main main dengan cara sodakoh karma akan kena sendiri gk usah berbuat kmu bodoh menyesal apa lgi bulan ramadan;1
anjir kenapa gue ketawa tapi bong nada sama;1
lucu sumpah ih lucu bgt saking lucu kaya pantat munding bangsat;1
lumayan buat uji coba vaksin covid aja org;1
youtubers tolol giliran ditangkap polisi pasti nangis;1
antara gila atau positif narkoba org;1
selaknat laknatnya setan masih laknat ferdian paleka ncerita tambahan;1
gila gila dasar orang punya akhlak;1
masih layak lha predikat manusia sematkan atas diri mu sedangkan pada hakikat apa perbuat lebih hina dari pada mereka waria lakukan;1
ferdian paleka itu bkan lelaki tpi banci klau emang dia lelaki sejati dia pasti mau bertangung jawab atas ksalahan liat dari konten aja jijik tpi anehnya bnyak yng folow and subs chanel dia haha;1
ayo dong heker indonesi bantu polosi lacak ni orang kampret dari akun yutubnya itu heker indonesia kan banyak;1
bukan setan bulan ramadan kurung kenapa yang bebas;1
pegel mata gue ngeliat si najis;1
serasa pengen nginjek batang leher babi babi;1
ferdian paleka semoga lo masuk penjara;1
bentuknya kek syaiton babi tu orang;1
bginilah kalau otak dikasih dengkul tololnya natural asu;1
muka alakadarnya masih bergaya lg sadar;1
apa cuma gua eneg liat muka org tolol itu;1
inalilahi wainailaihi rojiun semoga ahir dari segala buat anda merendahkan orang tidak mampu mnta like orang dong sama kita berdo;1
model begini aduk dulu diserahkan pihak berwajib ampas aja;1
anak hasil mama papa main gelap;1
muka kek gk usah kasih ampun lah tpi bong basi;1
masukin ke sampah ajah orang kayak mah dasar;1
konten youtubenya pada gk guna ditambah prank gk ngotak siap jadi ayam sayur tangkap youtuber tertolol dimuka bumi;1
preng opo iku cak bong matamu;1
setiap konten chanel aja ada bner dia itu akhirnya skg kena apes mampus;1
usah viralin guys nanti subscriber naik mending kita rame rame report unsubscribe chanel dia dapat duit percuma masuk penjara tapi sub naik bakal jera;1
berasal dri kelurga mcm apa setan itu;1
astafirlah perbuatan sangat tercela gimana orang tuanya nt pastinya terluka;1
harus cari itu orang biari masuk penjara gimana;1
harusnya kasih pelajaran orang kaya gini;1
jangan contoh aklaq seperti itu kasian si korban mereka hanya berharap sesuap nasi tpi perlakukan sperti itu jangan pandang mereka hina mereka juga sama seperti kita juga punya hati;1
penjara youtuber bangsat paleka asu mati penjara loe;1
gua saranin jangan cabut laporanya lanjut aja ngeselin palg video klarifikasi minta maf ngeselin anjir;1
dia kira itu dia gta san andreas bisa lolos dari kejaran polisi;1
anjing podaran sia ku aing ferdian;1
moga sj si bangsat ferdian ketangkep warga muak kelakuanya wajahnya congkak itu remuk;1
ganteng kagak gaya alahuakbar najis kyk sampah;1
orang bangsat itu ntr ke tangkep nangis si anjing;1
semua nangis liat dia tuhan setan malaikat pemimpin negara orang tuanya netizen hewan artis alam alien njer semua aja pada nangis pertama kalinya manusia terlahir seperti ampun;1
dipenjara nkasihkan para waria nbiar masa nbiar ditendang congornya;1
mampusin aja ketemu gue putus kepalanya;1
didoakan aja kak dosanya ush dibales hal sama apa bedanya kalian sama ferdian ngelakuin sama;1
androgamer exe hehehe tuhan aja maha pengampun kak sama manusia pendosa seperti kita;1
bisa masukin paku ke perutnya si ferdian;1
anjing kau ferdian tungu aja waktumu;1
orang emang sengaja pingin masuk penjara pingin rasain kali gimana penjara;1
dia kurang ajar sekali bukan minta maf mala main main ingin dia tangkap;1
sumpah cuk kalau ketemu dia langsung ku pukul njing;1
ktmu gw lo gw gk mau main pukul negara hukum cuma gw cemplungin lu ke truk septi tank;1
kesel gua anjing apa coba prank ke like setuju;1
geus boga nyawa sabara sigoblog teh;1
ngakak dasar psikopat minta maf tapi bong;1
setan aja melongo lihat orang kek gini;1
manusia punya otak tuhan bakal balas lebih perbuat;1
bandung mana bocah bru bawa mobil bekas mirip taxi aj gaya gayan lu monyet;1
dasar anjing kau suatu sat kena taik muka lo babi;1
hasil sperma rijek seperti itu semoga kasus selesai cuma dengan kta maf saja tapi hrus ada sanksi tegas buat setan berparas tampan itu;1
orang kaya merendahkan orang miskin km;1
oalah menungso iki tow neg gawe prank ra pener kui cah asu antemi wae;1
mau lari kmna loe babi hach mati sdah loe babi;1
duh alis ferdian cukur banci dia;1
ferdian raimu koyo lanangan homo jijik cuih;1
tenang dek usah main hakim sendiri;1
boleh sih nampol mukaknya minta maf bongan itu;1
emang bener anak lonte ferdian ketemu habisi aja bisa satu keluarga ditendang aja kota bandung gembel semua;1
hancurkan orang ayo waria kumpulkan masa waria jeblosin orang ke sel sampai akar akarnya dia jadi miskin;1
ferdian paleka lebih banci drpd waria itu;1
manusia apa mungkin setan bermuka manusia;1
arwah gw akan tenang sampe si anjing ketangkep;1
orang tuanya tangkap aja pak polisi buat jaminan sebelum pelakunya tertangkap;1
pengen gua pukulin tu anak anjing;1
nanti masuk penjara penjara gantian kasih sembako isi taik ;1
mamam noh viral lu anak setan;1
sekarang tuhan sedang melihat menyaksikan siapa pejuang membela kaum waria pejuang membela anak muda kurang ajar alah akan memilih membela keduanya;1
doakan semoga alah swt mengabulkan doa semoga mereka masuk hotel penjara amin nyang setuju leik end komen;1
dede alfatahizudin buat orang kaya raya itu adalah hotel penjara yang paling indah;1
contoh anak lahir dari perkawinan anjing sama babi;1
ferdian paleka pingin dengar kabar lu modar;1
inilah contoh babi kasih nyawa sama aloh;1
hidup pasan aja banyak gaya lu tong kaya iya aja hidup masih nyusahin orang tua juga banyak gaya;1
ciduk aja nangis nangis anak setan kelakuan bocah;1
pgn gua ancurin tu muka babi;1
ferdian sekali makan daging kenapa otakmu pintar jangan makan genjer terus jadi otak mutolol permanen;1
jember bengt gua liat mukanya najis;1
pengen banget gue gebukin bocah ketemu berapa plat mobilnya gua tabrak sekalian gue py bmw sayang buat nabrak loe anjing;1
ni org bawanya mobil style orang kaya tapi pny otak aj w bndung ketemu gw siksa tu anjing ferdian paleka gw gunting congornya ngrendahin org gw congkel matanya bsa lgi bkin konten sampah kluar lu bangke jngan jdi pengecut;1
klw anak anjing mah susah lu liat aja nanti klw ketangkep pasti sosoan lemes timpa meja pala pak;1
gue sumpahin lo ferdian jdi orang miskin;1
anjing semoga loe sekeluarga miskin turunan;1
zaidan makanya kalau mau doakan jelek;1
kelakuan hina akan dibalas hina juga entah itu akn menimpa dirinya atau mungkin klrg kelak;1
penjarain aja buat pelajaran kondisi kaya gini bocah tolol jadi emosi;1
hei anjing binatang lo ketemu jln bunuh aja anjing bkan manusia lo;1
tolol masih ada sudi subscribe chanel youtube dia;1
kelakuan setan muka nyh dh kya orang stres;1
inget lo anjing sumpahin orang susah sedunia dasar anjing kau akan sengsara seumur hidupmu;1
bulan suci do a kn semoga kmu orng plng miskin miskin miskin dunia;1
bangsat nibu lu tu ampe mewek;1
miskin dari termiskin paling miskin dunia namin;1
kan pasti buat si ferdian palentod itu;1
tolol anjing anak idiot cari sensasi femesnya naik;1
manusia bejad kelakuan atitude kayak sampah salah asuh orangtua neh lahirin manusia kampret kayak ferdian cs;1
nanti ke tangkap nangis jijik sampah;1
lu terlahir buat jadi sampah bocah;1
ahlak mu lebih menjijikan dari sampah nastagfiruloh hal azim nsmga aloh menurunkan hidayah;1
ngeprank banci sekarang kayak banci beneran sembunyi sembunyi culun;1
iya lo mafin tapi bong tolol;1
gua ketemu dia mah langsung sambing make sampah bangke tikus;1
orang gila inimah yakin stres kayanya;1
kayaknya orang ada dendam pribadi sama bencong atau waria;1
gini jadi kalau lahir kecampur taik;1
asu rupo uwong ki yo ngene iki;1
kelak si palekampret akhirat mau disiksa;1
dasar orang tolol ada otak ada ahlak goblog;1
lebih hina daripada binatang ni orang;1
tanya sama malaikat maut apa saja lakukan dunia membuat prank banci membuat vidio tidak pantas sudah mafkan tapi bong;1
modar sia anjing ngerakeun bandung wae;1
najis pengen rasany lsg bakar aj iblis bentuk manusia itu;1
transgender jauh lebih mulia daripada dia;1
anak haram lahirkan dari sampah busuk;1
periksa aja kyknya narkoba sehinga manusiawinya ilang anjing;1
judul cara masuk penjara dengan prank nhahahahaha;1
pegen buat lelucon tpi keterlaluan akhirnya jadi mala petaka mampus lo;1
ngak ada otak emang ni orang kelakuan iblis;1
minum bejo jahe merah masuk angin ambyar;1
mas didi kempot ofical ade kali nbukan mari nkalo mo meramaikan bukan temanya brad ntapi amin moga terima sisi alah;1
kesel gua sama dajal yang atu npaling abis nangis minta map;1
dalam vidio semua salah yutuber hukuman pus upin aja nasihatin kalau menurut tujuan dia mengasih perlajaran sama bencong sudah psb malah mangkal berdekatan aja nga boleh si bencong malah mau jual diri tambah bulan ramadan sibencong bukan bisa nyebarin virus corona aja tapi bisa tambah banyak orang jadi gay mendingan tekanin bencong untuk asramain obatin nga jual diri tambah banyak gay tambah banyak bala negara;1
report aja yutube sama ig manusia sampah mampus kena laknat;1
kurang ajar itu jngn senskx menghina coba kami mskn sndiri itu;1
kebablasan anak klw lihat mirip bencong juga;1
seharusnya antemi dulu serahkan ke polisi semoga maha kuasa membalasnya balasan dunia hanya bwt rakyat miskin;1
emaknya dulu selingkuh lahir anak haram jadam;1
ferdian anak hasil kawin silang anjing ama kambing makanya otak binatang;1
anjing kambing nsmoga nti lo mati masuk neraka;1
bulan ada berita banci mutilasi seorang pria;1
ah lho tu sama anjing kelakuanya;1
ganti shift sama setan yang masuk neraka;1
anjing org gaya aja gede ke jakarta mampus lw;1
mayan ginjal paleka mahal woy ginjal m ginjal m dong kuy ambil ginjal paleka buat donasi;1
akhlak lbh rendah banci tsb muke mesum;1
hahahaha dasar mulut sampah kelakuan sampah tobat jang muka kaya homo malah ngerjain waria;1
ferdian minta maf tapi bohong nmalaikat masuk surga tapi bohong;1
manusia kaya gini harus mampusin dari bumi;1
masukin ke penjara nusa kambangan aja lah si anying;1
penghinan proses sesuai hukum ganjar hukuman setimpal;1
muka aja homo gayanya kaya banci nkelakuanya lebih dari waria;1
semoga hidup lu lama bang tapi bong;1
orang harus kasih ke homo orang kaya gini;1
anak orang kaya nga ber ahlak memghina orang miskin alah lenyapkan lah kekayan;1
dih parah banget lu pada ngatainya mukaknya kek pingiran lobang jamban bang;1
setelah antum komentar demikian ndan ngua langsung ngaca sambil balik badan nternyata pantat gua paling ganteng ketimbang tu monyet;1
setiap konten chanel aja ada bner dia itu akhirnya skg kena apes mampus wkwk;1
koruptor punya duit susah tapi bong;1
tertawamu menjadi dukamu nkita tungu episode selanjutnya tangismu dari perbuatanmu;1
bangsat ni ank tenyata lebih dari sampah smoga penjara jera manusia spt;1
pemghinan terhadap umat islam bulan suci ramadhan harus ditangkap dibuat menyesal seumur hidupnya;1
sombong minta maf aja bohong tangkap sebelum kena masa ra kat bisa mampus;1
kebanyakan c li dia jdi mines otak ketemu hajar aja apalagu bocilnya lemparin batu baru masukin pnjara;1
anjing jelek ada akhlak sampah lo;1
dia gila apa gimana si anjirt;1
kurang ajar kalian nsemoga alah segera membalas perbuatan mu;1
anjir minta maf tapi bong nmukanya itu lho nkalo masuk penjara ganti rugi;1
bodohnya dia dari lahir referensi dari anime aho girl;1
rasa gua mau mampus tu org sekalian keluarganya semoga dia dikutuk turunan;1
astagfirulah kurang ajar bangat nh orang giliran tangkep loe ama polisi nangis loe najis;1
tangkep mereka smpe lolos nemosi liat youtober kelas teri otak bego;1
muka anjing gk usah ketangkep polisi mending ketangkep warga langsung aja hajar baru serahkan ke polisi wkwkw;1
kalau ketemu emang lu berani buat ajak duel;1
jahat bgt segitunya bgt buat konten;1
konten lu sampah semua kaya orang pantes aja lu kaya mukanya kaya;1
bajingan nh orang belum marahny orang miskin y bisa km makan mentah;1
anak mana si dia gua gampar atau gua santet jauh ni orang kurang ajar bgt bangsat orang tua mampu mendidik anak tntng akhlak gni;1
otak sudah waras masukin aka kemulutnya sampah itu;1
jangan cengengesan anjing hidup lu bakal tenang;1
emang anjing lu you tube juga berpendidikan nayo sini ribut ama gue ngue jijik lihat loe anjing nfucek loe;1
ketangkap polisi baru nangis lu bajingan;1
dajal pn gk nerima nurani ni org;1
orang kaya gini mah kasus dulu viral;1
ngerti gw sama itak orang kek gini tolol;1
ferdian paleka lebih kejam dari pki jauh lebih kejam dari pada pembunuhan;1
tangkap aj pukulin dulu menghina tu melecehkan;1
tangkap masukin sel bareng waria tahu rasa;1
so ganteng anjir malu warga bandung aja;1
hahaha jdi buronan lu babi mampus youtuber kaya lu wajib hajar;1
waktu dia lahir bukan adzanin anjing in nmakanya kelakuanya kaya setan;1
huzayad al faqih lubis elu sampah;1
jangan lupa bancinya juga sampah lebih rendah dari sampah nkakashi;1
bunuh aja org kyk gini bangsat biadab;1
anjing kau ferdian ktemu gua bunuh kau;1
manusia sampah nyoutuber sampah nmampus aja lu babi;1
bangsat lo tangkap hukum seberat beratnya cengengesan;1
can ngasan jero beteung na isian tali tampar ku aing daria kadie dia ngeprank ka kulon ka daerah aing pencitan ku aing beheung na daria parab keun ku aing ka buaya dia;1
heran chanel ada k subcribe dong nbtw next doi lepas penjara inget buat punya usaha blacklist orang tsb nbukan ajari jahat ntp hal itu pantas buat dia yang merendahkan istilah kemanusian;1
pansos anjing yutubers bngsd subs cn yt dia mnding batalin;1
nge prank waria muke ama gaya aja sendiri kaya waria;1
ferdian mukanya mirip sampah ndan kelihatanya homo nwajahnya mirip gay;1
bakar aja halal dagingya pak polisi tolong penjarain anak si anjing itu gtw banyak kesushan malah susah anjing bakar aja;1
numpang hidup dibandung malu bocah ngerakeun urang sunda sia idiot;1
xtc mana sia anjing budak xtx eweh nu beungeutna siga sia nbudak xtc boga etika jeung tatakrama teu siga sia nu teu boga otak jeung teu sakola;1
buat atau rw tempat bajingan tingal;1
emak lu ngelahirin lu tapi bong nelu diambil tempat sampah;1
hahahaha memang dia bodoh dari lahir referensi dari anime aho girl;1
semoga chanel ferdian paleka hapus dari youtube org gila belum kena batunya dia;1
ortu dulu ngewe dia baca doa jadi anaknya begini ada jin masuk bareng pejuh bapaknya;1
dia ngeprank bencong masih keluyuran tengah wabah;1
bangsat anak bagaimana pun waria itu juga manusia boleh direndahkan;1
yalah mukanya pasan make anting pula kek banci masih aja kelakuan kek sampah;1
bangsat ni orang nhajar rame aja orang model bgini nanjing;1
perdian bebaskan nkarena terbukti tidak bersalah ntapi bohong nmampus lo tar sodomi;1
yang ngajarin ngomong tapi bong siapa sih;1
kalau sudah tahu rumahnya ayo bareng ramai kirim sampah;1
roda terus berputar tpi qt lihat aja suatu sat nanti dia pasti jatuh qt semua hanya bisa melihat apakah kan dia masi bisa sombong ats perbuatanya sama makan nasi tpi gk punya aturan;1
orang brengsek berani berbuat berani bertangung jawab;1
penjara aja lah nmanusia sampah kayak gini pantas hidup hidup ada rasa syukurnya si kampret itu;1
asli bangsat pengen gua tampol biji peler;1
nanti masuk penjara kasih makan aja batu bata sama sampah;1
itu sih perbuatanya melangar ham juga yang disebutin tadi pelecehan;1
suruh makan sampah aja setahun makan sampah dasar sampah gada kreatif lu sampah;1
lh org paling bodoh xda pendidikan sngup bt kt warga mcm tu mula msti warga rasa gmbira bila dpt sembako amat mereka perlukan tpi bila buka smpah mereka dpt lh org bodoh mak bapak hantar pergi sekolah bolos jdi mcm lh minta polisi indonesia tangkap org mcm mentang mereka youtuber boleh bt kt warga mcm tu dislike jew chanel mereka salam damai dri malaysia;1
mari sama sama kita katakan mampus loe njing;1
berbuat bejat terus mintak maf penegak hukum harus tegas;1
gua doa in ampuni dosa ntapi bong ua;1
kudu hukum setimpal nbiar orang bego gini mampus;1
emng anak setan babi penjarakan orang;1
balang ke ndas e wae asu menungso bangsat rak nde utek ketemu aq ng dalan titeni we asu rak nde utek ngisin i indonesia bajingan menungso rak nde utek;1
lebih hina dia dri pada para waria tersebut naudzubilah;1
dia salah satu setan jin sejenisnya berkeliaran diantara umat manusia;1
menyepelekan sekali youtuber najis lihat mukanya;1
yaelah waria kagak hina lel xd;1
sang ghub ngebacot trus kaya lo gk hina lol mungkin lo lebih hina daripada waria ngetik alah swt aja salah bocah maen f aja sana;1
sang ghub iya emng ngebela karena waria juga manusia nkalo mungkin orng hina ngebacod blg hina atau emng bukan orng;1
dony rizaldy waria itu memang makhluk hina;1
risky arta menurut tuhan waria itu makhluk hina;1
dony rizaldy waria itu makhluk hina lucu kali menjadikan orang yang bingung gendernya sebagai manusia alias waria itu adalah manusia;1
folkwhore sekali hina waria itu tetap hina;1
folkwhore biarin aja mulut gw pedes yang penting kenyatanya waria itu hina dihadapan alah daripada kau pembela makhluk hina waria ngak pantas kau jadi manusia ngak pantas;1
dony rizaldy terbaca anda benci dengan alah subhanahu watalah dengan rasulnya;1
sang ghub lah elu lebih dibenci lah karena sudah menghina ciptan alah walaupun dia waria dia juga manusia punya perasan haduh kadrun;1
risky arta bebal anda terhadap waria sudah terlihat anda makhluk yang hina sama seperti waria;1
sang ghub lo ngehina ciptan tuhan artinya lo juga ngehina tuhan ncontoh;1
disat kondisi seperti jangan buat konten kaya bgtu;1
mentolo ngiles raine muni tapi bong;1
nanti vidio penjara lebih yahud polisi yang kau permainkan tungu vidio;1
kasian lu bos masih muda masuk bui selamat menikmati bos sel;1
ganteng kaga kelakuanya jelek nminta maf ko begitu ndih amit gilani;1
cicing bangsat tu manusia apa hewan;1
adalah salah satu manusia berhati iblis;1
bajunya religius bangat ntapi semuanya fake nwaria itu ada salah apa sama si setan ntapi prank kambing jantan nsemoga penjara sering dapat prank ferdian;1
bentuk manusia bermoral dajal seperti ferdian;1
sbtulnya kasian yuk kita mafin sama tapi bong;1
tolong gue ketemu sama nie orang darah halal buat gue bunuh;1
cengar cengir lu anjing konten bermutu tangkap pak polisi;1
orang kan biasa buat konten video nawar harga psk tepi jalan kan ndengan waria aja lu benci;1
hajar rame rame orng ky gni jijik liat mukanya;1
sumpal mulutnya pakai sampah tu ferdian bangsat;1
alhamdulilah banyak doain hati nak nsaya doain smoga rejekinya banyak ntapi bohong hahahahaha mampus;1
mampus aja orang gk punya hati itu terjadi pada kelg apa sodar a apa msh bisa ketawa;1
gk usah hukum langsung bakar halal dajal menyerupai manusia;1
bong kalau lu masuk bui bro he;1
dia itu bukan manusia dia itu binatang anjing;1
kebanyakan mengirup sampah si setan jadi prilakunya seperti sampah;1
orang pada susah bongin waras nh merusak anak bangsa;1
orang kayaknya lahir dari lobang pantat;1
anak jin dia anak setan engak;1
akun yutub dia itu kan kebayakan sampah isi y kalian inget wktu konten ngewek itu;1
masuk penjara los tu anus spt jalan tol plong;1
usah kalian ngajarin org bangsat kalian sdri jalan naik mobil masker;1
kasih masuk bui menghina manusia geram itu;1
mampus kau dasar kau sampah masyarakat;1
jangan jangan dia anak haram makanya kelakuanya haram semua;1
buset baperan semua yaudah hapus komentarnya nmaf semuanya yang merasa terasingung;1
yakin semua netizen memafkan eits tapi bong;1
dasar manusia dajal kau tolong buat aparat bandung ringkus manusia mcm dajal;1
gk masuk akal ni orang like setuju ia masuk neraka;1
tolol gini aja lu masih bisa ngemis kau kontol;1
oh jdi si anjing dekil ada otak itu berharap bener w si anjing sat lgi ngeprank digebukin sampe lemes mulutmya disumpel batu sampah;1
gua doain elo masuk penjara habis itu didalem penjara pantat elo gangbang digilir ama bencong sambil teriak ampun om hahahaha amin setuju like;1
ciri ciri masuk neraka jalur prestasi;1
kocak chenel akan gua gigit tapi gua pukul anjingnya karena diemin pasti gigit terus;1
joglis chanel gue ikut gebukin anjing boleh bos;1
mampus luh brensek berakhir hidup tandai mukanya ferdian dajal;1
