comment;label
maudy tapi nikahnya ama jesemantap mbak;0
yang suka filing in the blanks;0
mantap semuanya harvard university stanford university;0
ok teng kiu gu veri gut;0
wanita terhebat inspirasi para pemuda indonesia;0
yang dari tiktok mari kita kumpul;0
yang suka daei mbak najwa tu;0
keren wanita hebat i love maudy;0
selalu suka sama content mba nana;0
liat kak maudy kayak wah keren;0
kekurangan orang pintar juga kok hehehe;0
siapa masih nonton bulan puasa tahun;0
itu aslinya karena minder kok hahahaha;0
ngeliat maudy bisa sukses kaya gini;0
ujian senang banget oh my god;0
ok maudy this is about wk;0
smua dikira mudah harus kerj keras;0
kenapa sekilas suka muncul wajah awkarin;0
lau dia gw juga suka belajar;0
keuntungan jadi pintar bagi mba apa;0
waktu sd cuman fokus balap tamiya;0
senang lihat wanita cantik selalu menginspirasi;0
jadi proplayer esport juga keren kali;0
yoki defriantoro maf dari mobile legends;0
bsok kl ak jdi org tua;0
hebat maudy ayunda nkep study hard;0
juga suka ujian soalnya pulangnya cepet;0
keren nmampir dong ke sini htps;0
keren jadi pengen tapi sekarang hamil;0
two smart woman and smart topics;0
terimakasih sudah menginspirasi banyak orang kak;0
selalu menginspirasi mod nbarakalah sehat selalu;0
besok uts denger makin berasa capek;0
juga betah kok baca buku sehari;0
dengerin oborolan dua wanita luar biasa;0
apalah otaku yang hanya seongok kentang;0
dua wanita yang keren abis like;0
orang pinter ngomong enak liatnya adem;0
bener bener menikmati bngt perbincangan hebat;0
ke depanya bisa pakai subtitle kok;0
yang menginspirasi kaya gini kok trending;0
mudah mudahan ada perempuan kayak maudy;0
sukak banget nsukses slalu maudy ayunda;0
beda ketawanya orang yang suka belajar;0
mudahan ngaji juga pinter mbak maudy;0
senang sekali melihat orang inspiratif bertemu;0
saifudin mohamad amin alah terimakasih kak;0
semangat kaka yakin kakak juga sukses;0
harvard jadin back up its okay;0
hbs liat maudy malu liat jokowi;0
sd gue bercita cita jadi dokter;0
semua org bisa memanfatkan privileged baik;0
petani nonton ginian survey bibit terbaik;0
tipe temen yang suka ngingetin ulangan;0
didikan orang tuanya maudy keren sih;0
orang tuanya maudy keren didik anaknya;0
inspriratif congratulation maudy semoga lancar sukses;0
karena pulang pagi uang saku lancar;0
bulak balik new york harvard ok;0
kita hanya bisa melihat suksesnya maudy;0
dua orang cerdas ngobrol enak liatnya;0
owh senang banget yang trending beginian;0
maudy cocok pemeran cwek hary poter;0
mimi koko jabatan mentri kan banyak;0
salfok sama alis maudy kaya kebalik;0
orang pinter mah beda pemikiranya nmantaplah;0
mayudi lulus mau luar biasa banget;0
kok senyum sendiri lihat dua orang;0
iya emang sosok kugy nempel banget;0
mau gua bantuin berantakin siap membantu;0
dua wanita hebat yang patut contoh;0
simple thumbnail maudy ayundya auto nonton;0
dua perempuan hebat idola kaya gini;0
gw paham sih kalau cuma joke;0
teh sabrina aman kan setelah podcast;0
balikan lg sm agnezmo dong cocok;0
hr m kok langsung trending what;0
idola semua ba agnes sehat terus;0
suka lagunya agnes dulu ngompol ngompol;0
mangil yang kek cocok wkwkw mereka;0
baik banget agnesmo smoga tetap istikomah;0
agnes mo anak muda terbaik negeri;0
nanti abrinya ngambek sapa jaga keamanan;0
senang lht kalian berdua love you;0
paling suka dengar suara lak agnez;0
hebat sekali tayangan belum ada dislike;0
semua bentuk bibir cocok filer sih;0
enak bnget dengr cara ngomongny yak;0
orang pintar orang pintar itu cocok;0
pada masih bocah jaman gw smp;0
mantap dedy bintang tamunya agnes monica;0
diajak ke kua cocok mas ded;0
balikan cocok banget kang dedy corbuzier;0
suka banget kak dedy sama agnes;0
dedy agnes mo cocok sama smart;0
ngomong nge jero banget cok jndcok;0
filem kan bagus tu kang dedi;0
keren banget mantan tetap berteman baik;0
makanya tong sekolah jangan suka bolos;0
baru cocok dua orang visioner banget;0
suka sama agnes sejak ditralala trilili;0
contoh pacaran sehat by artis nda;0
kok lama milhatmu seperti miyabi mo;0
yo bagus bagus sekali lanjut kan;0
kok wajah agnes kok kliatan beda;0
salfok sama tshirt agnez limited edition;0
balikan z k kalian cocok bgt;0
ahwan adawan mau ae babu blok;0
keren kalian berdua emang the best;0
bok ngomong bahasa indonesia dong campur;0
the way she lok at you;0
buset enak banget ngobrol sama mantan;0
agnes mo tertawa aja enak didenger;0
agnes y alah idola kecil sehat;0
kog suka dngerin mrk berdua ngobras;0
kog suka dngerin mrk berdua ngobras;0
kok kelihatan lebih tua mbak agnes;0
siapa kah cowok lain penyanyi itu;0
kok ada comen cowok dimaksud agnes;0
keren ketemu mantan ora sekarep kaku;0
cocok ntapi ldr keyakinan itu ajah;0
dedy sebenarnya cocok sama agnes mo;0
kang sodrek dom nglegok teko kene;0
suka sama agnes dari dulu sampai;0
she loks like the handsome squidward;0
yang fokus ke limited edition mana;0
wah perna pacaran gokil crita mreka;0
cowok yang penyanyi siapa woi penasaran;0
akhirnya nonton juga keren sih hahahaha;0
mantap tim ajak balikan ajak seriusan;0
tingal nunguin kabar baik clbk mereka;0
bentuk mukanya kok sekarang berubah aneh;0
semoga cepat ketemu jodohnya lengkap kebahagianya;0
salfok sama bibirnya agnes kaya sulam;0
keren bgd part duanya ditgu bgd;0
idola wa dari kicil keren nez;0
hehehe mantap apalagi kalau dalam podcast;0
bunga damanik agnes umur dedy umur;0
komenya kok jadi pada bahasa ingris;0
balikan aja ded kalian cocok lho;0
suka banget sama agnes dari dulu;0
kok menarik ditungu lanjutanya mas ded;0
auto nyari foto dedy jaman dulu;0
apakah akan ada namanya clbk wkwk;0
btw galfok ma bibirnya si agnes;0
kalian berdua cocok sama sama pinter;0
seli yamanto ayo yo yo yo;0
bintang tamu terkeren adl agne mo;0
cocok padahal sama smart berwawasan luar;0
suka banget sama obrolan orang jenius;0
seli yamanto semoga hal itu ada;0
paling suka sat agnes maksud te;0
salfok sm bibirnya kya beda sih;0
suka banget ketawanya agnez renyah nular;0
erna elida mis chokat sama bri;0
aq suka bngt sama aqnes pintr;0
mantan terindah kok bisa akur nmantap;0
keren mas dedy mbak agnez mo;0
gile berkualitas terbaik begini kagak trending;0
selalu cantik kak agnez ncocok sma;0
wow the great story sejarah banget;0
dedy hebat pernah pacaran sma agnes;0
penyanyinya siapa broked your heart agnes;0
ternyata first love silahturahminya terjalin baik;0
keren parah naku pernah nemu gosip;0
acara bagus tapi kenapa lihat tayangan;0
senang liat mereka ngobrol lepas gini;0
anda keren parah serius agmo dedy;0
gk terlalu senak liah seperti inian;0
hoh gk percaya kok bisa mau;0
suka sm tawa lepasnya agnes mo;0
agnes suka cowok pinter bukan fakboi;0
nostalgia suka dech podcastnya cb clbk;0
gua kok terima dedy mantanya agnes;0
gara gara fyp tiktok langsung ksini;0
intip jalur pedalaman aceh kanel kami;0
agnez mo idolnya para idol terbaik;0
kok mukax agak berbeda sih agnes;0
dri dulu smpe suka liat agnes;0
kok muka agnes kayak banyak permak;0
salah satu perempuan paling suka lihat;0
kok gue baru agnes mantan ded;0
ternyata kalian bucin pada jamanya hahahahah;0
sehari jutan kok trendingnya naik naik;0
sems you are matched lho nlok;0
apa cuman gw suka semua lagunya;0
wow agnez mo besok jokowi dong;0
paling suka agnez man kita kenek;0
kesini gara tiktok ngaku lu pada;0
idola aing dari zaman tralala trilili;0
oh my god loked at him;0
mana dedi kok ngundang nisa sabyan;0
kok senyum terus nonton suka bngt;0
kebapa seh agnez mo selalu keren;0
th tak tercium media its nice;0
gue paling suka bahasa anak jaksel;0
idola podcast indonesia sehat terus ded;0
ngeri suka jebak pertanyan tak tok;0
jadikan artis napa anak baik tu;0
salam podo logat cuk nmojokerto nonton;0
dibalik kecerian cathez memendam sebuah kesedihan;0
suka sama cathez anaknya apa adanya;0
orang polos banget kaya jaman dulu;0
gajelas ni cewe ngomong nlancar toxic;0
cek mata ke dokter dulu kak;0
pacar idaman ni bos sengol dong;0
seorang bapak mulai melihat sesosok menantu;0
itu bikini namanya susah amat ngomong;0
gw lebih suka livy dari pada;0
anak baik baik triger bener mah;0
wong suroboyo iku pekok wkwkwk ngakak;0
cewek ngawur bet ngomong tapi suka;0
emg dedy the beast papi idaman;0
kok gua jadi ikutan nangis anjay;0
sumpah aq malu kok lucu gtu;0
cuma fiki paling mantap banyak bahasa;0
lah kok malah bahas tentang ketek;0
besok lupa undang meyden btr ded;0
angkat jadi anak gk broken home;0
kok gw malu nonton podcast naduh;0
cathez top semangat sehat sehat selalu;0
terharu balik cathez yang selalu ceria;0
cathez semangat terus anda sangat hebat;0
awokwok kek gua ngomong kdang gelepotan;0
cina selalu identik dengan broken home;0
ajig cipok an sama mama sendiri;0
suka konten cathez yang apa adanya;0
ek baskom itu namanya pispot ded;0
ujung kok sedih tapi lucu wkwkwk;0
medok medok ala sby lucu haha;0
dia gk ceria sih nmarah dikonten;0
plot twist paling keren ctd coeg;0
emang cocok bocah sama ikhsan lemon;0
namanya anak baik dia apa adanya;0
menit menit akhir baru lancar nyambung;0
wow who are you bruh awokawokawok;0
cathez bagi adalah wanita luar biasa;0
wadu analisanya seperti kebenaran bagus sekali;0
cocok ni ama indra jegel ni;0
pusing klok ketemu orang kayak cates;0
bocah polos banget moga sukses kedepanya;0
bahasa jawa bisa ndikit nlogat muedok;0
tapi bagus cathez bisa jaga diri;0
ded sini berkunjung haha awowk awokw;0
ternyata bagus juga kepribadian ni cwe;0
adu sama kayes cocok ni orang;0
chatez enak banget ajak ngobrol wkwk;0
konten dia selalu gokil ceria menghibur;0
jujur lebih suka cathez drpd livy;0
yang terakhir kok bisa bisa rasain;0
sehat selalu cathez god wil bles;0
asli km mng kuat sehat slu;0
semoga sukses dapat jodoh terbaik cathez;0
yuk ayo jadian sehat selalu cathez;0
oh suka maen ome tv itu;0
lebih enak liat daripada si kayes;0
adu sama dustin kocok parah auto;0
orang seceria itu bisa mewek juga;0
iya dia broken home dari sma;0
zhong chenle lucu fokus ke mata;0
maklumin lah dia anak broken home;0
mending suport anak berprestasi lah blok;0
ngmg kok bletotan ngono to nduk;0
selalu ceria ketiz thank bang ded;0
luar biasa juga terharu bang dedy;0
hahahahaha send suroboyo melok bingung cok;0
oh suka live cinoy medok jatiman;0
sehat terus pak dhe dedy corbuzier;0
achmad didik cerai broken home dia;0
karepmu thez pokok ra nguntal gapuro;0
kok undang sic gepeng mas ded;0
tapi bagus sih kek gini dia;0
bentar mayden si ratu tik tok;0
coba undang lebih banyak pengusaha sukses;0
oh yang suka nongol ome tv;0
cak roto semoga mudahkan rezekinya bro;0
gua baru dia namanya cathez wkwkwk;0
palingan nanti si jon topeng wkwk;0
kalau undang palingan dia topeng kebangan;0
halah ntik malah pakek topeng saitama;0
gotham zodeqir hukumnya wajib buka topeng;0
iya si bebengus cekijrot gemes jokernya;0
patng kita lg bahas apa cok;0
felix singkek katok pesing ngak dekek;0
tapi majapahit kok tak pernah disebut;0
masya alah ustad felix super keren;0
denysaifulrizal silahkan anda suka sama ufs;0
parah jam menit berasa cepat sekali;0
seru gk sih kalau ditambah coki;0
kalok pintar hadapi orang mengajak debat;0
semoga koh felix keluarga sehat selalu;0
sudah subscribe smoga sukses terus chanelnya;0
alhamdulilah senang sekali nasehat velix daniel;0
keren banget obrolanya thanks mas daniel;0
ketakutan adalah hasil dari ketidaktahuan nice;0
halo bro daniel anaku namanya sama;0
bangkrut jadi fokus asal dapat duit;0
ustadz felik cerdas bicaranya cepat sekali;0
sangat nyaman dengan kedua orng atas;0
gile keren banget love love podcast;0
ku suka quote menit absolutely right;0
masya alah luar biasa ust felix;0
masya alah keren banget ustadz felix;0
barokalohulakum dua orang sangat aq kagumi;0
masya alah luar biasa ust felix;0
luar biasa cerdasnya ustadz felix siau;0
masya aloh sehat selalu ustadz fsw;0
sukses selalu mbk najwa semoga nular kesuksesan;0
keren ni mba ayunda jadi idola milenial;0
yang dapetin cinta maudy ayunda beruntung banget;0
baru mampir kesini karena abis liat tiktok;0
enak aja gw nontoin orang smart bgini;0
maudy ayunda memang sosok idaman semua pria;0
pengalamanx pun mba najwa be ta aruf;0
enak banget dengerin omongan orang orang pinter;0
keren maudy ayunda nsemoga citanta cepat terkabul;0
enak jadi perempuan nperempuan pintar dalam memilih;0
sosok seperti inilah yang patut kita bagikan;0
kak maudy sudah bagus rencana semangat dunia;0
ada nangis ngk sih liat nkok nangis;0
mbak najwa wawancarain adhisty zara dong terimakasih;0
sama sama beruntung ka suaminya juga top;0
great conversation by two beautiful smart women;0
ketrimanya mba stanford notabene mba terbaik dunia;0
malah suka nge game yang jadi wkwk;0
aja dapat uang saku jt fre mantap;0
kalau menurutku dizaman semua orang serba pintar;0
bagi yang langsung nonton mereka suka ujian;0
pun ujian senang nkarena bisa pulang cepat;0
kewakilkan bgt komenanya kadang suka nangis sndiri;0
w kek lg nonton perbincangan wanita idaman;0
jaman skrng anak muda malah mikir pacaran;0
liat cewe cantik pintar berbicara enak bener;0
nice maudy ayundha salam dari ymb kalimantan;0
but not everyone have a nice family;0
she great best of luck for maudy;0
generasi muda yang hebat mrasa pingin muda;0
berharap banget prabowo jokowi dialognya kayak gini;0
dua wanita panutan sangat menginspirasi wnta hebat;0
sol waw mantap terima kasih saran tipsnya;0
kalau wanita wanita smart ngobrol enak ye;0
kayaknya enak bgt punya sahabat kayak maudy;0
seru banget nyimak dua perempuan hebat ngobrol;0
liat dua orang pinter ngobrol enak bgt;0
antara harvard atau stanford npilih stanford nmantaps;0
dia dua perempuan keren kita menit aja;0
ih keren bangetinspirated banget mba najwa maudy;0
salut banget tapi salfok sama alis maudy;0
semangat pasti bisa lo orang hebat kok;0
ada niat harus privileged pasti bisa kok;0
kok jadi ikut seneng senyum sendiri kagum;0
maudy memang teman ngobrol yang baik mengasikan;0
makan apa kok bisa pinter bgt gestur;0
rikoyuliantosaputra lah baguslah cita jadi pilot mah;0
sangat memotivasi nterimakasih banyak wanita wanita hebat;0
karena merendahkan orang lain nga baik wkwk;0
two great women who are very inspiring;0
ternyata orang hebat itu ujian malah seneng;0
trendingkan banyak orang belajar dari orang hebat;0
hanbin nice timing nah ngejatuhin satu pihak;0
kameranya terlalu cepat pindah geraknya pusing liatnya;0
top global ranked mah very hard mhahank;0
definisi wanita super duper lengkap indonesia multitalent;0
irwan usman kok bisa liat begitu kak;0
gw kok jadi pengen berkata kata kasar;0
mereka berdua sama sama wanita hebat inspiratif;0
jaga kesehatan dedy hampir tiap hari upload;0
mantanya dedy keren semua ada kak agnes;0
sabar nungu lanjutanya suka liatx sama pinter;0
siapa sih penyanyi cowok itu dsukai agnez;0
lucu berdua ngomong pengalaman merek pacaran dulu;0
ku suka bgt kl kalian jodoh sbnrnya;0
kyknya cocok bgt gk balikan aj ded;0
penyanyi cowok dimaksud siapa sih dirli bukan;0
cocok abez kalian nikah nikah lah nikah;0
masih nonton nsuka banget lihat agnez bicara;0
cocok satu filer bibir satu filer dagu;0
sosok pantes disebut artis nterkenalnya bukan garagergaji;0
tahu dari dulu suka aja sama orang;0
pasangan cerdas cocok banget apalagi balikan huhuhu;0
agnes ketawa lepas banget suka aja liatnya;0
anak w pokok wajib les b ingris;0
walaupun tidak terlalu mengerti dibicarakan tapi suka;0
cocok banget lu berdua bro ded smart;0
dedy kayaknya k semua mantanya komunikasinya baik;0
agnes mo kok beda wajahnya pangleng ak;0
kok episode liat dedy agak salting wkwkwk;0
nonton kok mesam mesem sendiri bahagia lihatnya;0
mantap agnes mo artis berbakat go internasional;0
baru gua klok ded perna jdi guru;0
agnes mo ngomong aja enak anj suaranya;0
gacor bund pasti puas bgt melepas rindu;0
mana ada agnes suka ma opa opa;0
tetap menjadi teman baik cari persaudaran banyak;0
suka lihat bang dedi bila sma agnes;0
agnez mo artis multitalenta suka mamerin hartanya;0
dia cuma suka pamer bahasa ingris doank;0
cocok suami istri sepertinya satu isi kepala;0
ngomong opo kuwi yo kok ora ngerti;0
jadian aja lg ded cocok sama pinter;0
sht sukses idolaku mas dedy agnes mo;0
atrudokht kayaknya sifat itu melankolis pemikir pengingat;0
suka liat agnez kek gini simple elegan;0
suka agnesmo gara liat chanelnya daniel mananta;0
hidup baik aja kadang naik kdg turun;0
instagramnya azka smp blg kok bisa wkwkwk;0
fokus ke baju agnez mo nlimited edition;0
cuma dia gapunya haters sok ingris lu;0
i lok something new with agnez lips;0
asyik banget lepas becandanya dua baik sukses;0
sependapat mreka cocok dn mungkin bs berjodoh;0
diliat liat ded kok agak salting hahaha;0
agnez mo tu emang baik bgt lho;0
serasi gaspol aja sama sama suka fitnes;0
seru agnes emang top balikan aja deh;0
sih lebih keren daripada dilan yak wkwkwk;0
koko agnez vs cece dedy cahyadi wkekekeke;0
mudahan agnesmo balikan sama dedy nyusul mualaf;0
kok bisa akrab tanpa cangung sama sekali;0
i lok you in smpn salemba raya;0
bang mana part kelaman edit nanti garing;0
keren nyang setuju vlog berkualitas kasi like;0
benar semua itu melewati perjuangan tidak mudah;0
bibir agnes kok beda mirip a jolie;0
agnes loks so fresh with this hairstyle;0
whatever kalian talking suka pokonya ngbu both;0
kok sekilas mirip ariana grande cakep bener;0
iya iya mantan pacar kok sah diperjelas;0
fck couple tiktok ni want agnez dedy;0
kayak gini udang jng suka pamer tubuh;0
terus kok cuma atau th aja kenapa;0
beruntung bgt mereka ketemu satu sama lain;0
bukti nyata bahwa ingatan cewe luar biasa;0
makin cantik agnes gwe suka deh lihat;0
cerita sgt menyenangkan suka melihatnya sangat menghibur;0
wah seru bgt keren dedy agnes mo;0
mantul banget dua legend ketemu keren abis;0
konten paling gua suka sama agnes mo;0
suka lagu matahari ku time masa bercinta;0
ada kemajuan tembok batu bata sudah renopasi;0
senang banget kalau denger agnes mo bicara;0
part l kok ngak ada nangung banget;0
idolak bnget jaman maen pilem pernikahan dini;0
untung my quen jadian sama dedi cahyadi;0
seru baru dedy mantan pertamanya ka agnes;0
ko keliatan cocok bgt bisa balikan hihihi;0
emang semudah itu agnes dulu bedama dari;0
ehem jadi ikutan senyum denger ceritanya hebat;0
ded lo nikah aja sama agnes cocok;0
suka bnget denger mereka ngomong bhs engres;0
kayaknya dirly idol broken heart seingat ku;0
sudah suka agnez sejak lagunya si meong;0
seli yamanto gratis tipu tipu ni pasti;0
berharap supaya agnes mo cepat ketemu jodohnya;0
seli yamanto liat jadi ikut seneng wkwk;0
horas orang batak suka samamu karyamu agnes;0
sukses terus kak agnes nterus makin sukses;0
akhirnya top juga gw tungu dari kemaren;0
ngak suka sukses sehat selalu panjang umur;0
agnes cocok sama ded ci balikan ajh;0
enak kalau berjuang sama sama pakai sensasi;0
suka bgd ma kalian berdua pk a;0
kenapa salfok sm gold chain of whitenya;0
sekali agnez mo tetap agnez mo keren;0
lanjutan mna nsalfok sama tulisan baju agnes;0
pusing denger bahasa dicampur gaenak bgt didenger;0
calon penyanyi bukan gapaham bang gaenak didenger;0
selalu sukak sm agnes terlalu sempurna km;0
dedy kelahiran tahun brp kok gogling kelahiran;0
fans agnes monica kecil mpe sangat suka;0
kalian cocok si dri pd sm onoh;0
baru ded pernah pacaran sama penyanyi keren;0
a suka banget pokoke sama mereka berdua;0
masakan ibu terenak didunia nisa sabun wkwk;0
ada yang punya hubungan baik dengan mantan;0
it great my idols both of them;0
orang orang hebat bisa berhubungan baik mantan;0
lucu namanya juga masa kekanakan ncerita silam;0
siapa sih cowok penyanyi itu kepo ni;0
coba diundangnya bersaman dengan kumalasari disebelah agnes;0
mbk agnes suka banget sm mbk agnes;0
iuah dedy corbuzier cinta pertamanya agnes mo;0
agmo lagu diamond gd videonya padahal bagus;0
asiknya pacaran jaman dulu pernah ngalamin banget;0
kok yang nontonya malah senyum senyum sendiri;0
suka sama lagu ka agnez sejak sd;0
lama kayak tiktok ada part part an;0
coba dong undang kub padepokan anti galau;0
orang tua agnes adalah orang tua hebat;0
apa cmn gw salfok ke kalung agnes;0
lima kali nonton bosan keren banget sih;0
senang ded jadi pacar pertama k agnez;0
awal mulai kok gua liatnya ayu ting;0
suka agnes sejak pernikahan dini cantik banget;0
agnes mo my idol from zaman kibenen;0
jaman dulu apa mng sosmed blm secangih;0
agnes memang sehumble itu gokil jaim keren;0
kok ada setengah jam biasanya lama ngobrolnya;0
wow wow wow keren ma agnez mo;0
terlove dari jaman masih piyik kak agnez;0
dedy sama agnes mo cucok banget kali;0
agnes mo mang keren smart girl banget;0
dedy agnes balikan saja kalian berdua cocok;0
abg gua jaman god bles atau superkid;0
suka banget lagu rindu by agnez mo;0
mada sih ingris juga gampang pahami kok;0
episode terbaik chanel menurut agnes sangat cerdas;0
penasaran penyanyi cowo agnez heart broken siapa;0
idola gua nie sat jaman kanak kanak;0
dari jaman duet ama eza yayang suka;0
aq suka agnes dulu anak an hihihihi;0
seru bgt asli kok nonton film gw;0
suka banget liat cewe etnis tionghoa ketawa;0
nangis mungkin kurang perhatian dari sosok ayah;0
kesukan dedy bocil fetish loe ni ded;0
chatez tu lucu suka org asik polos;0
dia cina baik hati belikan es krim;0
nangis dikarenakan rendahkan podcast nyesel ke podcast;0
gokil sih bisa nyimpen sebesar itu balik;0
asli ketawa karena topi menutupi ketua an;0
asalamualaikum dedy mantap podcast wawancara si cathes;0
ampun ah awal obrolan kok bengek bgt;0
ampe puyeng kepalaku ngomong apa sih cok;0
ml itu apa sih masok liank hah;0
sumpah cathes rendom bgt orang awok awok;0
lebih cocok jadi adenya livy renata kepolosanya;0
dibalik cerianya cathez ada sesuatu tentang ortu;0
masih polos pendidikan keluarganya keras tapi bagus;0
kok endingnya gw nangis ngerasain banget endingnya;0
cathez mirip gadis ngomong kasar jorok no;0
lucu ngakak anjoy wkwkwkwk sehat nonik cantik;0
pentingnya sosok ayah dalam pertumbuhan seorang anak;0
emg sosok ded selalu orang segan sih;0
konten sulap aquarium kaya dedy jaman dulu;0
apa cm gua cowok bulu keteknya lebat;0
camel toe namanya bukan bukan catle fet;0
semoga dedy bisa kasih suport nasehat baik;0
mbok pertanyan arah pertanyan itu agak filter;0
awal jelas klimaks akhir kok bisa ngis;0
sosok ayah memeng berarti bagi anak perempuan;0
dibalik orang ceria terdapat kesedihan bisa diceritakan;0
ded undang meyden si dia orang hebat;0
dedy suport chanel alam semenit chanel keren;0
mabok kerang hijau malah ajak podcast gini;0
dibalik kecerianya kayaknya ada luka mendalam dikeluarga;0
gokil ndari semua konten paling membagongkan gokil;0
keliatan bentuk itu namanya camel toe fyi;0
duh endingnya ikutan nangis nsukses terus chatez;0
undang udinkashiwagi udinkashiwagi tiktokers nkontenya sangar beut;0
jujur belum paham dengan topic yang bahas;0
ikut nangis juga broken home pasti merasakan;0
cina tidak ramah jadi kasih ice cream;0
sukses jaya selalu podcast clos the dor;0
sukses alah swt amin youtube ndedy corbuzier;0
dia emg bukanya broken home yak kyknya;0
isi video dirangkum disini semua bro mantap;0
bang i love you dewasa sekali suka;0
pemahaman dengan kata lebih sulit dengn bicara;0
sambil ntn kok sambil kesel juga yh;0
dibalik cerianya tersimpan kesedihan dalam butuh sandaran;0
sukses alah swt amin youtube ndedy corbuzier;0
kemoceng koncolodon brokoli deskripsinya anjay banget bun;0
kok jadi berasa pedofil nontonin video kali;0
memang agak susa mengerti nperlu pemahaman ketelitian;0
berusaha ceria depan org salut sama cathez;0
semoga perilaku orang indonesia jadi baik semua;0
masih suka minta ngundang pereview film weh;0
ceria bgt hlo sak benere cah iki;0
wkwkwkwk alah kok bisa sih berk baskom;0
nonton mulai awal sampai akhir lucu cok;0
kasian ending yang melihatkan dibalik semua kecerianya;0
ngomong kapan lalu sambil medok paling best;0
sumpah terakhir kok kel air mata y;0
inget koe ndu selalu jaga diri kesehatan;0
langsung auto sub pokoknya makin sukses cathez;0
be strong cathez semoga ketek berjamur sehat;0
apakah namanya alasan untuk menutupi tangisan sebenarnya;0
ketiz mangat trus km ud keren bg;0
si ketek itam keren sukses trus cathez;0
semangat cathez semoga sukses dalam karirnya amin;0
halo cantik pendengar dedi corbuzier enak sambil;0
gk gua suka ma ni anak cuma;0
jokes ketek jadi keinget nketiak ibu item;0
emang lebih baik nton yusub drpada tv;0
resletingnya terbuka luar biasa kata dedi corburser;0
catez broken home makanya jualan dari smp;0
bang kae anak minta minta kok suport;0
juga broken home hahaha hidup seperti sedih;0
aduh kok detik terakhirnya mengandung bawang hais;0
arek suroboyo ta iki kok medok ngomonge;0
senyum sendiri liat omonganya anak jaman now;0
super kocak emg cewek ncocok ama pascol;0
bch sopan ni kya gw suka ded;0
suka iseng juga si tapi jadi sangar;0
terkadang kecerian seseorang bukan berarti nyata bahagia;0
cahbagus lah lu juga urusin omongan gw;0
agar tidak podcas saran jangan folow tiktok;0
rajin bener bang upload video mantap jiwa;0
keuntungan kacamata hitam nbisa liat tanpa ketahuan;0
smbil ngopi lah nontonya nsehat slalu omded;0
susah njir si jon paling topeng wkwkwkw;0
mungkin mau sepertinya kecuali pakek topeng saitamanya;0
john suruh topeng banteng aja misal jadi;0
wkwkw terus dia datang pakai topeng bjorka;0
daniel tlng suka campur bhsa ingris indonesia;0
alhamdulilah tercerahkan terimakasih ustazd felix mas daniel;0
masyalah keren bgt ust felix tq daniel;0
podcast yang sangat mantaph sekali sunguh menginspirasi;0
ko gmn ada kesulitan puasa kok ada;0
masyalah luar biasa pemaparan dari ustadz felix;0
thank you alah luar biasa menginspirasi buanget;0
