comment;label
senakal apapun masa muda tapi kalau masih bisa menangis itu tanyanya org baik sbetulnya manusiawi;0
anak kuat banget dia nangis aja masih ceria seakan dia tidak mau ngasi apa masalahnya;0
ambil intinya prinsip catish luar biasa semoga makin sukses nom dedi cerdas bnget mengali informasinya;0
dri cara ngomong pun tw kan hnya bisa bantu cathez ak doakn kmu sukses cathez;0
oalah mas ded sampah undang iki lho cah cilik jadi ikutan kosakata sampahnya nwedokan sampah;0
semoga aja idola si cantik ku jadikan anak angkat sama ded cocok gmna ntar azka;0
suaranya kok mirip yang chines wanita itu siapa lupa namanya yang biasa kolab ma nopek;0
si anying jambud itu ngomong emang sableng itu cewe makanya gw suka nonton dia live;0
duh kok berasa berat terakhirnya ada sesuatu bs kita ungkapin publik itu sikap dewasa sesunguh;0
podcast ded emang ngak pernah sepi konten sangat mengedukasi memberi hal yang positif salam sukses;0
pantes enak didengernya umpatanta dia kalimat makian dia pinter mah apa apa gue denger anj;0
dari dulu suka sama bintang tamu karena suka ngomong kasar nentah kenapa org pada suka;0
balik kecerianya ada sesuatu menusuk hatinya dirundung kesedihan ntah ada masalah dalam kehidupanya atau keluarganya;0
cathez keren cewek mandiri dari ceritanya lebih deket sama neneknya tanya kerja papanya dia begitu;0
yo sering lihat hpku ono video metu awakmu emang jaman saiki banyak abg sing kebablasen;0
dari katanya bisa nangkep sih sukses terus chatez sampe salah bergaul cari cwo bisa pacar;0
selamat pagi menjelang siang nsemoga hari penuh ceria nslalu beri kesehatan rezeki yang berlimpah amin;0
akhirnya bocah laknat nongol ctd nkalau lihat cathes inget masa sma asik los dol pokoknya;0
iya mantap si jhon kita semua stil in the house penasaran muka dia kek mana;0
suka sama ustad felix siaw nceramahnya cepat mengerti penceramah kedua dari kh zainudin mz idolakan;0
wow luar biasa ustad felix memang cerdas i like it semoga sehat selalu amin rob;0
banyak orang dengan mudahnya mengambil alih tugas tuhan menginginkan hidayah untuk orang lain itu berubah;0
terimakasih kak daniel hebat berani undang ustadz felix nlama lama podcast dedy kalah maju terus;0
tidak pernah bosan samsek denger obrolan ko daniel ustadz felix ok guzel keren abis swear;0
tambah sukses auto trlambat nonton sedih gw;0
mas hasan gimana si caranya agar bisa dpt hp mas hp aq suka eror;0
sukses terus bang nsemoga rezeki abang lancar amin nig;0
bagus bang vidio bayu mika i bang;0
makin sukses selalu jangan lupa berdoa kpd alah yang telah menjadikan kita sukses;0
semoga sukses hasanjr juga sehat selalu amin nig andiluph;0
semoga hidup mas hasan penuh barokah nsemoga bsa dapat hp;0
ok sip makash banyak bos ku yang asli;0
semoga cepat datang namin rabal alamin;0
semoga makin sukses bang slalu memberikan konten bagus untuk kita semua amin;0
semoga slu sehat sukses selu bertambah murah rejekinya;0
terima kasih atas kebaikanya semoga aloh yang membalasnya semoga sukses ibu sulastri dari cempaka putih barat sebelas rw no;0
bang hasan kluarga sehat sukses selalu dunia akhirat amin;0
ma alah semoga mas hasanjr semakun berkah alah mudahkan berjuta juta subscrib semakin banyak membantu hamba alah dalam kesulitan alah senantiasa memberkahi alah semakin bertambah ilnu iman setelah mem folow mas gasanjr semoga lah anak satu satunya laki laki juga bisa berhati mulia spt mas hasanjr alah amin alahuma amin alah;0
ala mas asan baek ati saliberbagi sedama orang jang jujur berkah rezeki asan saling membantu sesama amin;0
sangat mulia sekali masih muda tapi jiwanya sangat baik sukses selalu mas hasan;0
aloh akan menganti kqli lipat atas kebaikan masku amin;0
alah semoga bisa pertemukan ama abang hasan yang baik amin;0
subhanalah terharu bahagia nonton kak semoga semua orang orang baik selalu dalam lindungan alah swt amin rabal alami;0
coba garut ada orang seperti mas hasanjr anaku terbantu gojeg garut juga lg sepi kapan mau ke garut mas;0
awloh permudahkan lah segala urusan bang hasan limpahkanlah rezeki banyak;0
berkat kebaikan sukses trus bng hasan;0
kontes seperti inilah yang kami butuh untuk menyirami rohani kami orang dekat laut yang wataknya alami keras nterima kasih bang hasan siram semoga tambah sukses tetap dalam lindungi tuhan yme amin;0
doa terbaik mas hasan pahalanya mengalir alah swt sehat selalu panjang umur y godluck y mas hasan amin y robal alamin;0
semoga kak hasan lancarkan rezekinya slalu dalam lindungan alah lebih banyak rezeki;0
suka chanel hasan smga tmbh naik subsribe;0
mas hasan baik sekali sucses mas amin;0
semoga mas hasan jr rejekinya lancar sukses selalu panjang umur amin robal alamin;0
terharu semoga mkin lancar rezekinya amin;0
mudah mas hasan beri kesehatan lancar rjkinya;0
masha alah tabarakalah semoga alah membalas kebaikan mas hasan rezeki banyak;0
smoga mas hasan diberi kesehatan selalu meyebarkan kebaikan bagi orang tidak mampu;0
orang baik pasti bertemu dengan baik pula;0
mari kita viralkan segala kegiatan baik mereka;0
terbaik semoga hasan sentiasa murahkan rezeki;0
smga youtube tiktoknya makin sukses bg;0
terima kasih bang hasan karena sudah membantu mengeluarkan air mata salam serumpun dari nterharu banget;0
jadi terharu melihat hal yangvseperti sehat selalu banh hasan selalu tebar kebaikan;0
tuhan terharu liahat anak hasan semogah berkahi terus nak hasan sama tuhan mudahan putra ada bisa seperti nak hasan nsalam dari tanah bugis nak hasan;0
terharu banget terus tebarkan kebaikan mas untuk siapapun;0
aq cuman punya ibi kak aq gk perna merasakan namanya aya;0
pernah bosen lihat abnk kita slu membantu;0
langsung subscribe semoga mas hasan real baik tetap org baik sukses terus mas hasan doain org kaya rejekinya lancar hutang lunas amin;0
alah ikut tak terbendung air mataku mas hasan baik banget;0
ma alah tabarakalah bleberan terus kalau lihat youtube mas hasan barakalah sukses terus semoga lebih banyak orang yang terbantu dengan kebaikan mas hasan amin yra;0
masya alah kayak gini jadi motiy untuk bisa jadi orang punya kalok punya banyak lebih pasti bisa ngasih banyak ke orang mudahan alah amin rabal alamin suatu hari ntik bisa memberi banyak ke orang;0
ngomongnya jaya kumur jelas kontenya bagus sih;0
bang hasan ntrus trus bos tuk bantu orang gk mampu barokah tuk anda semua pjang umur murah rezeki diberikan kemudahan dalam segalanya amin yra;0
konten konten menguras airmata terimakasih lanjutkan berikan konten seperti sangat bermanfat;0
luar biasa mas hasan smg akan menjd contoh kita semua;0
alhamdulilah bravo bang hasan sukses selalu;0
semoga alah mempermudah rejeki mu ngab semoga terus konsisten membantu yang membutuhkan;0
bagus bos jadi orsil sosial mau tolong;0
mas hasan emang zos teruskan menebar kebaikan;0
semoga rezekinya lancar terus mampu untuk berbagi bos qu;0
semoga alah membalas semua kebaikan tambah banyak rejekinya amin;0
salut sama abng hasan jr selalu berbagi kepasa semua orang semoga abng selau dalam lindungan alah swt makin lancarkan rezekinya amin;0
semoga sukses terus bang pajang umur murah rezeki amin;0
masya aloh gusti smg sukses slslu dunia akhirat;0
alah menyukai manusia berguna saling menolong sesamanya semoga memberi menerima mendapatkan rahmat maha kuasa;0
sedih liatnya sukses bang semoga sehat selalu;0
mas hasan ko baik banget ajibsemoga mas hasan selalu beri kesehatan bantu orang perlu bantu amin;0
sukses terus m hasan q bantu doa semoga m hasan sehat terus pajang umur;0
trmksh ud orang baik mao berbagi tuhan mberkati kmu;0
content seperti itu enaktonton terharu sama membatu sekali sangat bagus semoga aloh membalas kebaikanya amin yra;0
kontenya bagus kurang sopan kalau ngobrol seperti itu;0
asalam mualaikum ngw terharu sangat kebaikan mas hasan nsemoga mas hasan selalu sehat selu lindungan alah swt namin ndan semoga rezeki mas hasan mudah kan juga;0
hanya alah swt mampu membalas semua kebaikan bang hasan juga kru;0
semoga mas hasan sehat terus bisa melakukan kebaikan dari bp bersyukur semoga akan banyak orang seperti mas hasan;0
keren mas hasan tetap semangat bro;0
sampe merinding takjub dengan kebaikan mas hasan;0
mas hasan semoga alah kasih balasan yang lebih baik atas pemberian untuk orang orang yang membutuhkan yang sudah mas bantu amin;0
terimakasih alah masih dititipkan orang orang baik;0
alah tak terasa air mata mengalir mas hasanjr mudah banyak yng berhati seperti mas hasanjr salam dari jakarta;0
lihat sampai terharu nsukses selalu bang hasan;0
semoga kak hasan selalu diberikan keberkahan mudahan kita bisa saling membantu sesama mahluk alah swt amin;0
as mas hasan tlg bantu suami strok tahun;0
hasan km adlh pahlawan sejati km pants dapat ap km punya sekrang than akn membls ap km berikan kpd orang trus membantu lp berdoa hasan limpakn rezeki km;0
alhamduliah mas hasan telah membantu orang membutuhkan;0
semoga covid cepat hilang masa hasan;0
salam satu aspal h h barokah;0
semogah segala kebaikanya alah lipat gandakan segalanya serta amal;0
alhamdulilah konten bagus banget mga mas hasan pjg umur makin lancar rejeki sht selalu amin alah;0
semoga kebaikan dibalas dengan kebailan oleh alah;0
mas lanjutkan mas membantu sesama manusia semoga masnya beri kesehatan beri rezeky melimpah amin;0
alhamdulilah semoga diperluaskan rezeki kpd memberi agar dpt membantu mreka memerlukan amin;0
chanel mengajarkan kebaikan terima kasih banyak orang berbagi sedekah sat ad orang kesusahan;0
harus hasan jr itu harus viral sosial media betul kan dia pun suka berbagi;0
sangat terharu sekali nonton pidio yutup mas hasanjr semoga mas selalu sehat pajang umur banyak dapat rejeki agar bisa membantu orang betul jujur menjadi hambanya alah amin robal alamin alah kun payakun;0
sukses slalu mz hasan mga berkah;0
hasanjr nevan hobi makan npak polisi sahabat berbagi npak dedi mulyadi nbosque bapau naku suka chanel berbau sedekah;0
paling senang nungu chanel anak muda menginspirasi byk orng semangat terus mas hasan semoga lancar terus rezekinya bisa terus berbagi;0
imbas pandemi covid emg wow smg cepat normal lg nkerja hbs lebaran byr harian sedih bgt apalagi nonton vlog;0
alah permudahkan semua urusan adik hasan tuk terus membantu org memerlukan amin;0
mas hasan moga sukses selalu rezeki nambah banyak karena sudah iklas membantu org membutuh kan ikut terharu mas menonton vidio mas semangat terus mas;0
semoga virus corona cepat selesai amin alah;0
mas hasan is the best pokonya sukses mas hasan;0
aloh semoga sukses mas hasan nberbagi itu indah tidak rugi;0
sukses trus bang hasan sehat selalu smoga makin dilimpahkan rezeki;0
yalah semuga mas hasan tros sukses bir teros ber bagi amin ig;0
semua chanel abang hasan pokok keren semua persen semoga kak hasan selalu diberi keberkahan oleh tuhan yang maha kuasa;0
sumpah baik banget bang hasan semoga rezeki lanjar;0
semuga tros sukses bos hasanamin ig;0
alah lipat gandakanlah rizki bagi orang baik;0
mudahan aloh ganti lebih besar p hasan jaga ke ihlasan;0
mudahan ada receki dikasih sm bang hasanjr;0
alhamdulilah alah mg berkah nmg ms hasan semakin sukses sehat senantiasa lindungan alah swt;0
mantap sekali alhamdulilah saling menulong membantu orang kesulitan semuga aloh yang membalas suksis lancar surah hud;0
semoga mas hasan jr tambah sukses;0
moga wabah cepat berlalu nsalam satu aspal;0
gw like gw subricbe no skip lonceng hahaha pada giveway sukses smngt berbagi harta lebih untuk berbagi ke kurangan smngt;0
sumpah kakak hasan baik bangat sesama manusiasmoga bisa seperti kak hasan;0
alah sunguh mulia hatimu bang hasan mudah an bang hasan sekeluarga sehat tambah rezekinya oleh alah amin;0
baru namanya konten m i p i i;0
semoga semua org kaya spt hasan murah rezeki;0
asalamualaikum mas hasan luar biasa semoga selalu dalam lindungn alah swt amin;0
semoga beramal jaria selalu dapat barokah dari aloh sehat selalu;0
masyalah sunguh mulia hatinya bg hasan smoga covid bisa hilang secepatnya amin alah smoga abg gojeknya juga bisa terhindar dari covid alah amin subhanalah;0
nice job anak indo wajib begini god job;0
bru kali gw lihat yutuber prank baik;0
semoga hasan jr tetap exsis istiqamah dalam kebaikan berbagi kepada mereka yang membutuhkan semoga bermanfat sukses selalu sehat selalu mas hasan jr;0
semangat terus k hasan jr mantap k;0
salot mas hasanjr semoga mas selalu murah rezki;0
semoga alah mudah kn perjalanan hidup and murah kn rezeki abang amin;0
senang melihat fidio mas hasan jr;0
bang semoga sukses kayak ata halilintar bang amin;0
mudahan dapet hp baru dari mas hasan amin yra nhp sekarang kurang layak pakai soalnya mudahan menang bismilahirahmanirahim;0
alhamdulilahi robil alamin nsujud sukur ke pada aloh nbarokaloh bang;0
semoga lancar terus rejekinya bang hasan sehat terus panjang umur bang hasan;0
alhamdulilah makin banyak konten kebaikan seperti;0
semoga barokah y rejekinya mas hasan jdi org baik nig umimardiyanto;0
semoga sehat selalu mas hasanjr family sukses selalu tambah berkah barokah amin ig ekawatiaurora;0
salut bwt mas hasan jr sngat membantu konten a;0
masya alah trharu bngt smoga mas hasan dilimpahkn rzekinya smakin sukses;0
mas hasan top nsemoga sehat selalu bisa membantu orang lain membutuhkan;0
alhamdulilah semoga mas hasan selalu sehat diberikan rejeki barokah bisa bantu pada orang mbutuhkan amin;0
alhamdulilah mudah an mas hasan selalu diberikan kesehatan rejeki halal barokah;0
subhanalah smga bg hasan dimurah rezkiya slu sukses slu;0
semoga abang rejeki makin tambah oleh tuhan agar bisa lebih banyak membantu saudara saudara membutuhkan;0
lihat kebaikan air mata mengalir ikut menangus alahu akbar;0
asalamualaikum nsalut salut salut nwalaupun telat buka komen barunpunya hp bekas semoga sukses terus;0
orang baik selalu dalam lindungan alah swt;0
bs kurangi ngobrol lewat hp langsung saja lebih baik;0
sunguh hebat nsi emas sayah salut nsama emas;0
masa alah semoga dimudah kan rejeki dn panjangkan umur sehst selamat dari waba dn segala bala untuk nolong dn tolong amin;0
sehat sukses selalu mas hasan nsalut dengan kontenya;0
mudahan apa dilakukan dibls oleh alah swt berlipan ganda amin;0
slalu nonton acara kak evan kak tiwi mantap;0
kak hasan semoga selalu lancar rezekinya;0
kenapa org baik jujur selalu dpt pekerjan super cape;0
barakalah mas tetaplah jadi orang baik;0
semoga rizki anda lancar kt smua;0
asalamualaikum wr wb nbang sukses terus semoga selalu dalam lindungan alah swt nlanjutkan selalu tebar kebaikan;0
masya alah tabarakalah semuanya smgah berkah dunia akhirat slu diberi kesehatan lancarkan rezekinya;0
moga mas hasan kluarga slalu diberi kesehatan rejeki melimpah supaya trus bs membantu org membutuhkan amin;0
hebat mas terus sedekah mas salud mas hasan;0
mantab semoga sukses terus bang hasan jr;0
bang turun dong kok kan ngak enak;0
alhamdulilah begitu mulya sifat mu nak mudah an rijki mu bertambah banyak;0
lgi mewek nsukses slu mas hasanjr;0
mudah mudahan mas hasan berikan rizki lebih oleh aloh berikan panjang umur;0
hebat itu bkn apa kau punya apa kau beri hasanjr;0
semoga aloh membalas kebaikan mas hasan;0
alhamdulilah selalu beri kebaikan sehat terus sukses salam dari pontianak;0
kalian lebih suka nontonin chanel siapa nlike hasanjr nkomen ata halilintar nkawan bantu menuju subs;0
bismilah teruskan tugas yang mulia moga bang hasanjr keluar sehat murah rejeki amin nig ma;0
semoga kebaikan mu balas oleh alah swt bang;0
subkhanaloh baik bgt mas hasan smg beri kesehatan umur panjang amin;0
bisa terlihat koq mana asli riya tulus berbagi niat mengajak kebaikan anda benar terlihat tulus trmakasih menginspirasi;0
km baik sekali sih semoga km diganti berlimpah amin;0
asalamualaikum semoga amal kebaikan dapat jadikan contoh sama lain amin nfacebok fauzi jambi pinang riau nig fauzi abu bkr nwa nhp;0
terima kasih bang sudah banuak membantu orang yang membutuhka terus lah berkarya;0
si kok bnyak komen never surender;0
kalok nonton vidio mas hasan air mata mau jatuh trus;0
alah semoga kakak hasan murahkan rezeki lindungi oleh alah swt amin;0
makasi aloh masi banyak orang baik;0
smoga semakin berkah k hasan jr nsukses trus nig;0
alhamdulilah semoga dek hasan selalu sukses kami doakan semoga tembus juta subscreber amin aloh;0
tq sebab membantu orang kesusah han;0
alah baik banget mas hasan semoga berkah mas hasan dapat balasan dari alah rezekinya bertambah terus amin;0
emang bagus abang seneng lihat abangnya selalu berbagi sedekah;0
sukses selalu mas hasan orang tuamu banga mu;0
kenapa si kebaikan musti umbar apa gtu;0
cuma lihat jadi ikut senang sama like;0
barakalah bang moga ditambah bnyak rjki y dn barokah amin nig mukhlis;0
subahana wloh semoga dilancarkan rejekinya amin;0
alah terharu sekali melihat vidio semoga bang hasan dilancarkan dalam rejekinya mudah kan dalam mengupload vidionya amin nig;0
semoga semua beri kemudahan amin yra;0
draw my life terbaik pling memotigasa dri draw my life xg pernh aq tonton;0
alah semoga sodara kita yang bernama bang hasan jr tetap menjadi orang baik yang selalu lancarkan rezekinya beri kesehatan selalu amin;0
ni baru konten mntap bang semoga tambah sukses nlangsung gua scrb;0
menginspirasi bang gua juga pengen kaya elu bang bisa bantu orang banyak doain sukses bang;0
semoga bang hasan selalu lancar rezekinya;0
hebat bang hasan nsemga bang hasan selu limpahkan banyak rijeki amin;0
semoga bang hasan nlancar terus rezekinya sehat selalu;0
kak teruskan kebaikanmu sampai akir nafas;0
mas hasanjr tetap youtuber no indonesia mantap mas;0
hasan jr mg luar biasa smoga rezkimu brkah amin;0
semoga dilancarkan rizki sukses terus bang hasanjr;0
semoga bang hasan beri umur panjang amin bang hasan suka memberi reski ke orang salam makasar atas nama zulfikar;0
masya alah nsemoga rezeki makin lancar;0
alhamdulilah syukur semoga rizki mas hasan bertambah pak gojeknya semoga rizkinya tambah lancar amin;0
smoga bnyk youtubr membantu orang susah;0
masih jaman konten belas kasihan orang lain;0
semoga sukses terus bisa membahagiakan kedua orang tua amin nig rafi slm;0
subahanalah semoga rejeki lancar mas sama mas hasan panjang umur semoga sukses selalu amin;0
bagus harus kita turut kita harus berbagi rezeki sesama manusia;0
bang slalu seling kan konten kebaikan bang supaya banyak contoh oleh orang banyak makasih bang;0
semoga alah memberikan yang terbaik untuk hasan karena balik ngerjain fun tapi saling membantu;0
subhanalah kebesaranmu alah sangat terharu melihat kebaikan hambamu;0
sangat terharu sekali kebaikan mas hasan jr;0
berkah selalu bang hasan semoga makin sukses selalu;0
bang hasan baik banget nsemoga rezekinya lancarkan oleh alah beri kesehatan beri umur yang panjang berkahi hidupnya beri kebahagian dunia akhirat amin;0
bang semoga kebaikan abang diterima dengan alah swt;0
be yourself and never surender nsukses selalu sehat selalu untuk keluarga nig;0
sukses trus bro jangan bosen bosen bntu yng gk punya;0
bismilah nalahu akbar alah karuniakanlah nikmat kemudahan kelancaran bagi chanel mas hasan agar subscribenya bisa tembus jt secepat mungkin namin nmasih jt tapi berkah;0
sunguh mulia hatimu hasan trskan kebaikan jln alah;0
salut sama abg walaupun ada virus corona abg masih aja bisa bagi bagi salut gua bg semoga makin lancar rezeki abg juga sehat nig;0
sama ka hasan orang luar biasa responya terhadap masyarakat;0
konten apa an kok ngerjakin orang tua;0
masya alah nmantap semoga canel maju terus;0
bismilahirahmanirahim semoga menang nsemoga corona cepat hilang karena kurang hari ramadhan alah aminkan doa nig;0
masya alah ka hasan baik banget ingin bgt punya calon imam seperti ka hasan yang baik pada semua orang;0
semoga mas hasan selalu murahkan rezekinya;0
semoga semakin banyak orang kaya seperti anda bung nbarokalah;0
mas baik bangat minta tolong mas dibantu bersedia ni nomor rekening hampir bln bln narik sembako kbagian trm ksh sblmnya keiklasan kbaikan mas smoga dibls rezki berlimpah;0
masya alah tabarokaloh teruskan beramal sholeh;0
generasi peduli semoga dilipatgandakan rezeki sukses;0
smga bang hasan lancarkan terus rejekinya sehat slalu bang nig;0
terharu kak lihat chanel kakak mau bantu kayak kak hasan sukses jadi youtuber kyak kakak;0
murah rezeki mas hasan nsehat selalu and family nsukses terus nsuport untuk mas hasan nsemoga capai jt subscribe mas amin nsemoga menang a bg hasan amin nig;0
y alah mudahkan lh segala rejeki mreka harus berjuang tengah pandemi lancarkanlah rejeki mreka smw y alah amin;0
semoga bisa sukses ngebantu orang orang membutuhkan;0
orang baik akan bertemu orang baik nig;0
be yourself and surender suces for you bang hasan jr and family you are is the best you are youtuber number one god luck for you bang hasan jr nsaya pribadi pengen punya hp kayak temen hp bagus tapi mengerti keadan ortu;0
semoga amal ms hasan berkah barokah amin;0
be yourself and never surender nsemoga chanel bang hasan sukseskan terus keluarga sehatkan selalu nsemangat bang semoga menjadi subcreber koleksi mobil motor mewah terbanyak asia nkami disini selalu mendukung chanel bang ngodluck for you nig;0
semoga mas bantu selu berikan kemudahan rizkinya sehat selu amin;0
be your self and never to surender semoga sedekahmu diganti alah berkali kali lipat kak barakalah kak dilancarkan semua urusanmu you re my inspired nig shelyadianafn;0
bang hasan baik sangat berhati mulia peduli banget sama orang orang;0
semoga bang hasan diberikan kesehatan lancarkan rejekinya amin rabal al amin nig;0
bismilah barakalahu fikum jazakalah khair teruslah tebar kebaikan semoga alah membalasan mas hasan jr nig;0
alah swt akn pernh kasih rizki salah alamat masyalah klihtn bpk itu orang baik;0
semangat kak berkarya semoga cepat naik juta sub amin ig;0
keren asli sampe berkaca kaca mripat;0
be your self and neverto surender suces to hasan and aour family just only one youtuber ngod luck one youtuber fadhil my chenel nkota purwokerto;0
be your self and never surender suces for you hasanjr and family hasanjr is the best youtube hasanjr my idola bismilah semoga bisa dapetin give away hasanjr amin nmakin sukses sehat selalu bang hasan fathir m;0
be your self and never surender suces for you hasanjr and family hasanjr is the best youtube hasanjr my idola bismilah semoga bisa dapetin give away hasanjr amin nmakin sukses sehat selalu bang hasan fathir m;0
jh youtuber indonesia suka nton gdbles you hsanjr watching from mlaysia;0
sehat sukses selalu ndoa kami yang terbaik;0
go diamond play buton k hasan nsukses berkarya terus k hasan nbismilah nig sitisarah;0
ijin mamapir terharu lihat kebaikan mas hasanjr;0
suka banget sama chanel suka ngebantu banyak orang karena kalau ngak kita siapa yang membantu mereka mulailah berguna bagi orang lain;0
coba ikutlah kali aja dapat nsemangat terus kontenya bang hasan semoga rezekinya lancar selalu ninstagram;0
mantap mas hasanjr nsemoga rejeki makin lancar menuju subscriber juta;0
gue tipu gw usir karena niatnya baik alangkah baiknya kalau usah madang klikbait dramatis kek;0
semoga kak hasan menjadi youtuber yang sukses kedepanya amin nig;0
berkarya tanpa menjatuhkan orang lain naiklah tanpa melihat karya orang hasanjr njgn menyerah jadi orng baik sukses selalu hasanjr raxanda;0
sukses terus kak hasan semoga yang disemogakan tersemogakan semangat konten semoga kak hasan sekeluarga beri kesehatan amin nig;0
bismilah hirohman nirohim natas izin aloh semoga mas hasan jr sekeluarga sehat sukses selalu nsemoga dapet amin nig sofyan rxs;0
masya alah mulianya hti mu mas semoga rejeki mu lancar semua nbantu subscribe chanel;0
youtuber mah gini hasil adsends bagi in ke lebih membutuhkan dalam konten menurut bukan hanya soal pamer kebaikan tapi ada edukasi bahwa kita harus menghargai perjuangan orang tua orang lain juga rela menantang bahaya untuk kita semangat terus kak konten;0
masya alah smg berkah dn barokah amin sehat sl mas;0
bang hasan sukses terus nge youtube berkah selalu apa yang dikerjakan sehat sehat untuk keluarganya bismilah instagram;0
judulnya ngeprank penonton nsukses terus kak;0
ampun kasihan bapaknya tapi kak hasan baik;0
giveaway kuota aja bang orang pemenag nonto trus vido vido abang selama lokdonw;0
jazakalah brader hasan content penuh kebaikan;0
smoga mas hasan tambah banyak rezeki murah rezeki sehat slu;0
konten gini trus bang terbaik pokonya;0
semoga bang hasan semakin sukses dirumah aja tetap semangat menghibur kami bang hasan hasan jr inspirasi gua nig;0
mantap harus saling bantu sama sesama cuma pamer kayak chanel lain sip mantap mas hasan;0
bg hasanjr sukses selalu moga rejeki y lancar selalu menolong orang susah moga yutober bisa ngikutin bg hasanjr;0
semoga selalu sukses lindungi yang maha kuasa abang;0
subscribe nsemoga bang hasan sukses selalu nsemoga chanel terus berkembang nsemoga bang hasan cpet ke jt subs nig;0
baik banget si bang semoga dilancarkan terus rezekinya amin;0
alah bang hasan baik banget semoga rejekiny lancar subscribernya makin banyak sehat selalu wajib dicontoh bang hasan;0
do not stop fighting this covid virus;0
hasan jr memang top kekayanya pergunakan jalan alah swt semoga berkah mas;0
satu kata acara bang hasan mulia smg barokah semua;0
sat sujub nx air mata deras sukses;0
semoga lancar rejekinya mas terhindar dari fabah amin nig;0
kok coment banyak sama kayak orang mas hasan;0
semoga sukses bapaknya mas hasan kedepanya;0
masya aloh masnya sangat luar biasa berhati mulia smoga aloh membalas ke baiakanya tambah banyak rizjekinya amin;0
be yourself and never surender r suces for youtube hasan jr and your busines r hasan jr top prank right now and forever r be humble and don arogant r hasan jr humble person r god bles you brother r nig natan;0
be yourself and never surender r suces for youtube hasan jr and your busines r hasan jr top prank right now and forever r be humble and don arogant r hasan jr humble person r god bles you brother r nig natan;0
